{
  "schema_version": "0.9.0",
  "pack": {
    "id": "alpha12-godot-smoke-pack",
    "title": "alpha12-godot-smoke-pack",
    "version": "0.1.0-alpha.12",
    "generator": {
      "name": "Mapsoo Worldsmith",
      "version": "0.1.0-alpha.12"
    },
    "created_at": "2026-07-26T09:00:00.000Z"
  },
  "profile": "layered-depth-2d",
  "completeness_policy": "layered-depth-2d-complete-v1",
  "compatibility": {
    "godot_min": "4.3",
    "projection": "layered-depth-stage",
    "art_style": "pixel_art",
    "importer": {
      "id": "mapsoo_importer",
      "min_version": "0.1.0-alpha.12"
    }
  },
  "layers": [
    {
      "id": "sky",
      "order": 0
    },
    {
      "id": "far",
      "order": 1
    },
    {
      "id": "mid",
      "order": 2
    },
    {
      "id": "gameplay",
      "order": 3
    },
    {
      "id": "near",
      "order": 4
    },
    {
      "id": "lighting",
      "order": 5
    },
    {
      "id": "foreground",
      "order": 6
    }
  ],
  "atlases": [
    {
      "id": "terrain",
      "path": "atlases/terrain.png"
    },
    {
      "id": "props",
      "path": "atlases/props.png"
    },
    {
      "id": "structures",
      "path": "atlases/structures.png"
    },
    {
      "id": "collectibles",
      "path": "atlases/collectibles.png"
    },
    {
      "id": "effects",
      "path": "atlases/effects.png"
    },
    {
      "id": "player",
      "path": "atlases/player.png"
    },
    {
      "id": "npc",
      "path": "atlases/npc.png"
    }
  ],
  "planes": [
    {
      "id": "sky",
      "role": "background.sky",
      "path": "layers/background-sky.png"
    },
    {
      "id": "far",
      "role": "background.far",
      "path": "layers/background-far.png"
    },
    {
      "id": "mid",
      "role": "background.mid",
      "path": "layers/background-mid.png"
    },
    {
      "id": "depth-fog",
      "role": "background.depth-fog",
      "path": "layers/background-depth-fog.png"
    },
    {
      "id": "near",
      "role": "near.overlay",
      "path": "layers/near-overlay.png"
    },
    {
      "id": "ambient-light",
      "role": "lighting.ambient",
      "path": "layers/lighting-ambient.png"
    },
    {
      "id": "foreground",
      "role": "foreground.overlay",
      "path": "layers/foreground-overlay.png"
    }
  ],
  "roles": [
    {
      "role": "background.sky",
      "path": "layers/background-sky.png"
    },
    {
      "role": "background.far",
      "path": "layers/background-far.png"
    },
    {
      "role": "background.mid",
      "path": "layers/background-mid.png"
    },
    {
      "role": "background.depth-fog",
      "path": "layers/background-depth-fog.png"
    },
    {
      "role": "near.overlay",
      "path": "layers/near-overlay.png"
    },
    {
      "role": "foreground.overlay",
      "path": "layers/foreground-overlay.png"
    },
    {
      "role": "lighting.ambient",
      "path": "layers/lighting-ambient.png"
    },
    {
      "role": "lighting.local",
      "path": "layers/lighting-local.png"
    },
    {
      "role": "terrain.ground",
      "path": "atlases/terrain.png"
    },
    {
      "role": "terrain.path",
      "path": "atlases/terrain.png"
    },
    {
      "role": "terrain.edge",
      "path": "atlases/terrain.png"
    },
    {
      "role": "terrain.bridge",
      "path": "atlases/terrain.png"
    },
    {
      "role": "terrain.stairs",
      "path": "atlases/terrain.png"
    },
    {
      "role": "terrain.water",
      "path": "atlases/terrain.png"
    },
    {
      "role": "prop.tree",
      "path": "atlases/props.png"
    },
    {
      "role": "prop.rock",
      "path": "atlases/props.png"
    },
    {
      "role": "prop.crate",
      "path": "atlases/props.png"
    },
    {
      "role": "prop.sign",
      "path": "atlases/props.png"
    },
    {
      "role": "prop.lamp",
      "path": "atlases/props.png"
    },
    {
      "role": "prop.occluder",
      "path": "atlases/props.png"
    },
    {
      "role": "structure.entrance",
      "path": "atlases/structures.png"
    },
    {
      "role": "structure.exit",
      "path": "atlases/structures.png"
    },
    {
      "role": "structure.checkpoint",
      "path": "atlases/structures.png"
    },
    {
      "role": "structure.landmark",
      "path": "atlases/structures.png"
    },
    {
      "role": "collectible.primary",
      "path": "atlases/collectibles.png"
    },
    {
      "role": "collectible.health",
      "path": "atlases/collectibles.png"
    },
    {
      "role": "effect.footstep",
      "path": "atlases/effects.png"
    },
    {
      "role": "effect.interact",
      "path": "atlases/effects.png"
    },
    {
      "role": "effect.portal",
      "path": "atlases/effects.png"
    },
    {
      "role": "effect.ambient",
      "path": "atlases/effects.png"
    },
    {
      "role": "character.player.atlas",
      "path": "atlases/player.png"
    },
    {
      "role": "character.npc.atlas",
      "path": "atlases/npc.png"
    },
    {
      "role": "world.scene",
      "path": "runtime/scene.json"
    },
    {
      "role": "world.collision",
      "path": "runtime/collision.json"
    },
    {
      "role": "world.navigation",
      "path": "runtime/navigation.json"
    },
    {
      "role": "world.preview",
      "path": "previews/world.png"
    }
  ],
  "characters": [
    {
      "id": "player",
      "atlas": "atlases/player.png",
      "frame_size": [
        48,
        72
      ],
      "pivot": [
        24,
        67
      ],
      "clips": [
        {
          "id": "idle.left",
          "action": "idle",
          "direction": "left",
          "fps": 4,
          "frames": [
            {
              "x": 0,
              "y": 0
            }
          ]
        },
        {
          "id": "idle.right",
          "action": "idle",
          "direction": "right",
          "fps": 4,
          "frames": [
            {
              "x": 48,
              "y": 0
            }
          ]
        },
        {
          "id": "idle.near",
          "action": "idle",
          "direction": "near",
          "fps": 4,
          "frames": [
            {
              "x": 96,
              "y": 0
            }
          ]
        },
        {
          "id": "idle.far",
          "action": "idle",
          "direction": "far",
          "fps": 4,
          "frames": [
            {
              "x": 144,
              "y": 0
            }
          ]
        },
        {
          "id": "walk.left",
          "action": "walk",
          "direction": "left",
          "fps": 7,
          "frames": [
            {
              "x": 192,
              "y": 0
            }
          ]
        },
        {
          "id": "walk.right",
          "action": "walk",
          "direction": "right",
          "fps": 7,
          "frames": [
            {
              "x": 240,
              "y": 0
            }
          ]
        },
        {
          "id": "walk.near",
          "action": "walk",
          "direction": "near",
          "fps": 7,
          "frames": [
            {
              "x": 288,
              "y": 0
            }
          ]
        },
        {
          "id": "walk.far",
          "action": "walk",
          "direction": "far",
          "fps": 7,
          "frames": [
            {
              "x": 336,
              "y": 0
            }
          ]
        },
        {
          "id": "run.left",
          "action": "run",
          "direction": "left",
          "fps": 10,
          "frames": [
            {
              "x": 384,
              "y": 0
            }
          ]
        },
        {
          "id": "run.right",
          "action": "run",
          "direction": "right",
          "fps": 10,
          "frames": [
            {
              "x": 432,
              "y": 0
            }
          ]
        },
        {
          "id": "run.near",
          "action": "run",
          "direction": "near",
          "fps": 10,
          "frames": [
            {
              "x": 480,
              "y": 0
            }
          ]
        },
        {
          "id": "run.far",
          "action": "run",
          "direction": "far",
          "fps": 10,
          "frames": [
            {
              "x": 528,
              "y": 0
            }
          ]
        },
        {
          "id": "interact.left",
          "action": "interact",
          "direction": "left",
          "fps": 7,
          "frames": [
            {
              "x": 576,
              "y": 0
            }
          ]
        },
        {
          "id": "interact.right",
          "action": "interact",
          "direction": "right",
          "fps": 7,
          "frames": [
            {
              "x": 624,
              "y": 0
            }
          ]
        },
        {
          "id": "interact.near",
          "action": "interact",
          "direction": "near",
          "fps": 7,
          "frames": [
            {
              "x": 672,
              "y": 0
            }
          ]
        },
        {
          "id": "interact.far",
          "action": "interact",
          "direction": "far",
          "fps": 7,
          "frames": [
            {
              "x": 720,
              "y": 0
            }
          ]
        }
      ]
    },
    {
      "id": "npc",
      "atlas": "atlases/npc.png",
      "frame_size": [
        48,
        72
      ],
      "pivot": [
        24,
        67
      ],
      "clips": [
        {
          "id": "idle.left",
          "action": "idle",
          "direction": "left",
          "fps": 4,
          "frames": [
            {
              "x": 0,
              "y": 0
            }
          ]
        },
        {
          "id": "idle.right",
          "action": "idle",
          "direction": "right",
          "fps": 4,
          "frames": [
            {
              "x": 48,
              "y": 0
            }
          ]
        },